<!ELEMENT employees (employee+)>

<!ELEMENT employee (name, department, designation, salary, email)>
<!ATTLIST employee id CDATA #REQUIRED>

<!ELEMENT name (#PCDATA)>
<!ELEMENT department (#PCDATA)>
<!ELEMENT designation (#PCDATA)>
<!ELEMENT salary (#PCDATA)>
<!ELEMENT email (#PCDATA)>